{
  "id": "paper-theater-audio-preview-00000000000000000000",
  "kind": "paper-theater-audio-preview",
  "schema_version": "1.0",
  "source_preview_ref": "paper-theater-preview-11111111111111111111",
  "source_preview_path": "paper-theater-preview-11111111111111111111/preview-manifest.json",
  "source_preview_sha256": "aaaaaaaaaaaaaaaaaaaaaaaaaaaaaaaaaaaaaaaaaaaaaaaaaaaaaaaaaaaaaaaa",
  "scene_plan_ref": "paper-theater-scene-plan-22222222222222222222",
  "intent": "evaluation",
  "width": 1280,
  "height": 720,
  "scene_duration_ms": 1000,
  "offset_ms": 0,
  "duration_policy": "exact",
  "duration_tolerance_ms": 5,
  "synchronized_audio_end_ms": 1000,
  "clock": "audio-current-time",
  "roles": {},
  "segments": [{}],
  "assets": [],
  "audio": {
    "source_path": "voice.wav",
    "path": "audio/bbbbbbbbbbbbbbbbbbbbbbbbbbbbbbbbbbbbbbbbbbbbbbbbbbbbbbbbbbbbbbbb.wav",
    "sha256": "bbbbbbbbbbbbbbbbbbbbbbbbbbbbbbbbbbbbbbbbbbbbbbbbbbbbbbbbbbbbbbbb",
    "size": 16044,
    "license_status": "reviewing",
    "container": "wav",
    "riff_format": "RIFF/WAVE",
    "declared_format_tag": 1,
    "format_tag": 1,
    "encoding": "pcm",
    "channels": 1,
    "sample_rate": 8000,
    "bits_per_sample": 16,
    "block_align": 2,
    "byte_rate": 16000,
    "frame_count": 8000,
    "data_offset": 44,
    "data_size": 16000,
    "duration_ms": 1000,
    "duration_frames": 8000,
    "duration_rate": 8000,
    "chunks": ["fmt ", "data"]
  },
  "files": [
    {"path": "index.html", "sha256": "cccccccccccccccccccccccccccccccccccccccccccccccccccccccccccccccc", "size": 1},
    {"path": "player.js", "sha256": "dddddddddddddddddddddddddddddddddddddddddddddddddddddddddddddddd", "size": 1},
    {"path": "style.css", "sha256": "eeeeeeeeeeeeeeeeeeeeeeeeeeeeeeeeeeeeeeeeeeeeeeeeeeeeeeeeeeeeeeee", "size": 1},
    {"path": "audio/bbbbbbbbbbbbbbbbbbbbbbbbbbbbbbbbbbbbbbbbbbbbbbbbbbbbbbbbbbbbbbbb.wav", "sha256": "bbbbbbbbbbbbbbbbbbbbbbbbbbbbbbbbbbbbbbbbbbbbbbbbbbbbbbbbbbbbbbbb", "size": 16044},
    {"path": "assets/ffffffffffffffffffffffffffffffffffffffffffffffffffffffffffffffff.png", "sha256": "ffffffffffffffffffffffffffffffffffffffffffffffffffffffffffffffff", "size": 1}
  ]
}
